{
  "schemaVersion": 1,
  "id": "term_01HZX8K3Q9AI",
  "siteId": "site_01HZX8K3Q9EF",
  "taxonomyId": "tax_01HZX8K3Q9CA",
  "slug": "artificial-intelligence",
  "status": "active",
  "visibility": "public",
  "labels": {
    "en": {
      "name": "Artificial intelligence",
      "altNames": ["AI", "A.I."]
    },
    "tr": {
      "name": "Yapay zekâ",
      "altNames": ["YZ", "yapay zeka"]
    }
  },
  "parentId": "term_01HZX8K3Q9NW",
  "position": 2,
  "slugHistory": ["ai"],
  "rev": 7,
  "createdAt": "2026-10-08T09:00:00Z",
  "updatedAt": "2026-10-08T10:00:00Z"
}
